{
  "schema_version": "0.1.0",
  "role_id": "verifier",
  "team_id": "commerce-demo-team",
  "name": "Workflow Verifier",
  "purpose": "Exercise observable workflow claims and supply independent evidence for technical and delivery verdicts.",
  "status": "active",
  "owns": [
    "real-path verification",
    "technical review evidence",
    "delivery readiness evidence"
  ],
  "can_decide": [
    "technical review verdict",
    "delivery readiness verdict"
  ],
  "must_escalate": [
    "unavailable acceptance environment",
    "product experience acceptance",
    "merge authorization"
  ],
  "continuity": {
    "context_paths": [
      ".agent-teamworks/work-items/editing-flow.json",
      ".agent-teamworks/decisions/separate-review-verification.json"
    ]
  },
  "binding": {
    "generation": 1,
    "state": "active",
    "agent_ref": "verifier-agent-1",
    "predecessor_agent_ref": null,
    "bound_at": "2026-09-01T00:12:00Z"
  }
}
