{
  "schema_version": "0.1.0",
  "role_id": "experience-reviewer",
  "team_id": "commerce-demo-team",
  "name": "Product Review Advisor",
  "purpose": "Offer fallback product advice on the editing workflow without owning product experience acceptance or modifying the outcome.",
  "status": "active",
  "owns": [
    "independent product review advice"
  ],
  "can_decide": [
    "advisory finding severity"
  ],
  "must_escalate": [
    "requirement conflicts",
    "acceptance decisions"
  ],
  "continuity": {
    "context_paths": [
      ".agent-teamworks/work-items/editing-flow.json",
      ".agent-teamworks/decisions/separate-review-verification.json"
    ]
  },
  "binding": {
    "generation": 1,
    "state": "active",
    "agent_ref": "reviewer-agent-1",
    "predecessor_agent_ref": null,
    "bound_at": "2026-09-01T00:10:00Z"
  }
}
